username;date;retweets;favorites;text;geo;mentions;hashtags;id;permalink
;2018-05-15 23:44;0;0;"Karnataka election results 2018: As state throws up hung House, here's the party-wise seat and vote share https://twitter.com/share?text=Karnataka%20election%20results%202018:%20As%20state%20throws%20up%20hung%20House,%20here%27s%20the%20party-wise%20seat%20and%20vote%20share …";;;;"996453801438601217";https://twitter.com/18AKGOYAL/status/996453801438601217
;2018-05-15 23:44;0;0;"Karnataka Election 2018 results: BJP's southward march has begun, says Ram Madhav - The Hindu https://ift.tt/2IM0RD7";;;;"996453701056434176";https://twitter.com/JessieBottcher/status/996453701056434176
;2018-05-15 23:44;0;0;"Karnataka Election Result 2018 updates: Yeddyurappa calls BJP MLAs' meet tommorow, says ball now in guv's court LIVE News, Latest Updates, Live blog, Highlights and Live coverage - Firstpost http://dlvr.it/QSyKxG";;;;"996453691891871744";https://twitter.com/netamakerIndia/status/996453691891871744
;2018-05-15 23:43;0;0;"After The Karnataka Election Result Kerala Tourism Offers Beautiful Resorts To Mlas For Relax – कर्नाटक के सियासी दंगल पर केरल सरकार ने ली चुटकी, विधायकों को आराम के लिए किया आमंत्रित http://statusbang.ml/after-the-karnataka-election-result-kerala-tourism-offers-beautiful-resorts-to-mlas-for-relax-%e0%a4%95%e0%a4%b0%e0%a5%8d%e0%a4%a8%e0%a4%be%e0%a4%9f%e0%a4%95-%e0%a4%95%e0%a5%87-%e0%a4%b8%e0%a4%bf/ …pic.twitter.com/gOAcDwKNFX";;;;"996453599025737728";https://twitter.com/statusbangnews/status/996453599025737728
;2018-05-15 23:43;1;6;"We will fight for you: Rahul Gandhi to voters after Karnataka results http://dnai.in/fqvN pic.twitter.com/xJfepH4jqS";;;;"996453501780701184";https://twitter.com/dna/status/996453501780701184
;2018-05-15 23:43;1;6;"1) Karnataka shares borders with AP & Telangana on its eastern side. Here are the results from the eastern Karnataka districts. Don't buy "Telugus voted against BJP" propaganda. This result is quite normal here. BJP actually did better than expected in dist's like Chitradurga!";;;;"996453443681206272";https://twitter.com/KiranKS/status/996453443681206272
;2018-05-15 23:42;0;0;"Karnataka Election Results 2018: BSP Creates History as Candidate N Mahesh Wins Kollegal Assembly Constituency via @ indiacomhttp://www.india.com/news/india/karnataka-election-results-2018-bahujan-samaj-party-bsp-creates-history-as-candidate-n-mahesh-wins-kollegal-assembly-constituency-3055475/ …";;@;;"996453195667853313";https://twitter.com/Singh198509/status/996453195667853313
;2018-05-15 23:41;0;0;"Can a RTI b filed to know whether PMO office called up Karnataka Raj Bhavan after election results.or may b rajbhavan got a call from BJP headquarters for that matter.";;;;"996453151908622338";https://twitter.com/hirani_shamir/status/996453151908622338
;2018-05-15 23:41;0;2;"After looking at Karnataka results this is what I am thinking. BJP will loose in MP and Rajasthan. BJP will not cross 200 in 2019. Babu will win in AP and most of the states BJP will loose badly in state elections. I am going to pin this tweet till may 2019.";;;;"996453009126141958";https://twitter.com/hustler243/status/996453009126141958
;2018-05-15 23:40;0;0;"Karnataka Results: Seven Muslims Candidates Win in Karnataka Elections 2018 watch at https://youtu.be/ZP6i-v8Hkuw https://youtu.be/ZP6i-v8Hkuw";;;;"996452858533888000";https://twitter.com/ind2day/status/996452858533888000
;2018-05-15 23:40;0;0;"Karnataka Results: Seven Muslims Candidates Win in Karnataka Elections 2018: http://youtu.be/ZP6i-v8Hkuw?a via @ YouTube";;@;;"996452785364393984";https://twitter.com/ind2day/status/996452785364393984
;2018-05-15 23:40;0;0;"I added a video to a @ YouTube playlist http://youtu.be/ZP6i-v8Hkuw?a Karnataka Results: Seven Muslims Candidates Win in Karnataka Elections";;@;;"996452711435526144";https://twitter.com/ind2day/status/996452711435526144
;2018-05-15 23:39;0;0;"Good to see the Results of Karnataka but Power Hunger politics to continue.. Congress-JDS. Have faith in Centre Integrity n hopeful for Wishful conclusion..";;;;"996452649221308416";https://twitter.com/PouthaiK/status/996452649221308416
;2018-05-15 23:39;1;0;"Karnataka Poll Results: Yogendra Yadav’s Message For BJP, Congress https://www.thequint.com/videos/news-videos/karnataka-poll-results-yogendra-yadavs-message-for-bjp-congress …";;;;"996452492115406854";https://twitter.com/rajeevgodara/status/996452492115406854
;2018-05-15 23:38;0;0;"After The Karnataka Election Result Kerala Tourism Offers Beautiful Resorts To Mlas For Relax – कर्नाटक के सियासी दंगल पर केरल सरकार ने ली चुटकी, विधायकों को आराम के लिए किया आमंत्रित http://dailyhindinews.ga/after-the-karnataka-election-result-kerala-tourism-offers-beautiful-resorts-to-mlas-for-relax-%e0%a4%95%e0%a4%b0%e0%a5%8d%e0%a4%a8%e0%a4%be%e0%a4%9f%e0%a4%95-%e0%a4%95%e0%a5%87-%e0%a4%b8%e0%a4%bf/ …";;;;"996452328449433601";https://twitter.com/Urvishkathiriya/status/996452328449433601
;2018-05-15 23:38;0;0;"Karnataka Election Results: After Telugu Voters Opt for BJP in Karnataka, Andhra Pradesh and Telangana Next on Radar https://www.news18.com/news/politics/karnataka-election-results-after-telugu-voters-opt-for-bjp-in-karnataka-andhra-pradesh-and-telangana-next-on-radar-1749573.html …";;;;"996452324053729280";https://twitter.com/singhal_vikas45/status/996452324053729280
;2018-05-15 23:37;0;0;"Dear rahul... ji why you silent karnataka results. .whynot talk kumara swammy.. are you really pappu.. something do it for better government. .stop talking";;;;"996452096395243525";https://twitter.com/smeerkpblr/status/996452096395243525
;2018-05-15 23:37;6;3;"After Karnataka Results Ghar Se Kuch Door Nikalte Hi. Chalte Hi. pic.twitter.com/DZM2kMz5vW";;;;"996452057287507968";https://twitter.com/Adarsh_Rai694/status/996452057287507968
;2018-05-15 23:37;14;16;"Karnataka CEO statement on mismatch of EVM and VVPAT count in a polling station of Hubli-Dharwad Central constituency: Mismatch due to failure to delete mock poll data from EVM. VVPAT count incorporated in result, Jagadish Shettar of BJP declared winner pic.twitter.com/wMPIYJTmn6";;;;"996451987003617280";https://twitter.com/bhartijainTOI/status/996451987003617280
;2018-05-15 23:36;0;0;"Karnataka Assembly Election Results 2018: All eyes on Governor Vajubhai Vala, who had vacated his seat for Narendra Modi https://bangaloremirror.indiatimes.com/bangalore/karnataka-assembly-election/karnataka-assembly-election-results-2018-all-eyes-on-governor-vajubhai-vala-who-had-vacated-his-seat-for-narendra-modi/articleshow/64176160.cms … via @ bangaloremirror";;@;;"996451869646962688";https://twitter.com/UmeshaTweetsVK/status/996451869646962688
;2018-05-15 23:36;0;1;"After election result of karnataka , # modiji will understood that u r not able to get a job after scoring more That is D pain of Gen...category";;;#;"996451842073608192";https://twitter.com/sandeep922978/status/996451842073608192
;2018-05-15 23:36;0;6;"Karnataka election results: 8 short, can BJP still get the numbers? https://www.livemint.com/Politics/PYZALgxnX7iPJrGwutiFxJ/Karnataka-election-results-8-short-can-BJP-still-get-the-n.html …";;;;"996451778228113408";https://twitter.com/livemint/status/996451778228113408
;2018-05-15 23:36;0;0;"karnataka Result cleared,,, people are happy with BJP Ruling... Hence Congress should keep quiet,,, n concentrate cleaning it's own party... until people make noise against BJP...";;;;"996451712515825665";https://twitter.com/sjmhatre21/status/996451712515825665
;2018-05-15 23:36;0;0;"Very sadness movement in Varanasi when we was celebrating Karnataka result";;;;"996451671042613249";https://twitter.com/Parveen88360671/status/996451671042613249
;2018-05-15 23:36;0;0;"I liked a @ YouTube video http://youtu.be/ozFjEfB6Bpw?a Jan Gan Man Ki Baat, Ep 242: Karnataka Results and Complaint Over Modi's 'Menacing";;@;;"996451657688014848";https://twitter.com/AshishNotion_/status/996451657688014848
;2018-05-15 23:35;0;0;"What does Karnataka election result says, from Bangalore BJP won only 2 and 47% voting ... most literate n sophisticated people r bankrupt n didn’t voted for countries betterment, shameful";;;;"996451518713753600";https://twitter.com/frieeend2010/status/996451518713753600
;2018-05-15 23:34;0;0;"Nope. I beg to differ. We can say, bjp didn’t mean the expectations but the results have improved. Besides congress forming the govt is good news for bjp. Bjp is people’s choice (vote share) but congress’ govt so ppl will now wholeheartedly vote for bjp in 2019 in Karnataka";;;;"996451370264907776";https://twitter.com/SindhiChokroVB/status/996451370264907776
;2018-05-15 23:34;0;0;"Karnataka results: End of an era and AHINDA politics https://wideversion.com/article/43950";;;;"996451145085153280";https://twitter.com/wideversion/status/996451145085153280
;2018-05-15 23:33;0;0;"# karnakaElections Karnataka election results 2018 comedy memes https://youtu.be/5dvcacoVPFU via @ YouTube";;@;#;"996451119806074880";https://twitter.com/Naachystv/status/996451119806074880
;2018-05-15 23:33;0;0;"|Who said what TIMESOFINDIAnOM Karnataka election results: Who said what http://TIMESOFINDIA.COM | Updated: https://alvinbijo004.wordpress.com/2018/05/15/who-said-what-timesofindianom-karnataka-election-results-who-said-what-timesofindia-com-updated/ …pic.twitter.com/inImp9hAPW";;;;"996451010515173377";https://twitter.com/Alvinbijo1998/status/996451010515173377
;2018-05-15 23:33;0;0;"# Battleforkarnataka justice to reveal soon in the hands of the respected governor of KARNATAKA who might furnish a cmplr satisfactory result to all kannadigas SO ITS STILLL A HOLD ON KARANATAKA # modiunbeatable";;;# #;"996450934422097921";https://twitter.com/shanthraj_koudi/status/996450934422097921
;2018-05-15 23:33;0;0;"Pls be cautious and power comes with more responsibilities and accountabilities, hope you live up to the expectation, and we wish all the best for the Karnataka results and don’t just spread only anger against congress, it helped so far, doesn’t guarantee in 2019.";;;;"996450931767066624";https://twitter.com/sk46172/status/996450931767066624
;2018-05-15 23:32;0;0;"There was no pre-poll alliance.. But they certainly had an understanding and all of them were together under one banner of NEDA.. Anti-congress alliance.. So they did come together after election results and formed government... U cannot compare it with Karnataka..";;;;"996450730599890944";https://twitter.com/srajwadi/status/996450730599890944
;2018-05-15 23:30;0;0;"Karnataka Election Results 2018 highlights: Siddaramaiah meets Kumaraswamy, says Cong-JD(S) will form government http://www.moneycontrol.com/news/india/karnataka-election-results-2018-highlights-siddaramaiah-meets-kumaraswamy-says-cong-jds-will-form-government-2568569.html#live-blog-20180515193637 …";;;#live;"996450238171791360";https://twitter.com/GanapathiSM1/status/996450238171791360
;2018-05-15 23:30;1;25;"Karnataka election results: Tough road ahead for Congress http://read.ht/Bmtb pic.twitter.com/BXKu8ZAOGP";;;;"996450136422137856";https://twitter.com/htTweets/status/996450136422137856
;2018-05-15 23:29;0;0;"Ravish Kumar Prime Times on Karnatka Election Result https://www.facebook.com/jjpnetwork/videos/1685403844828996/ …";;;;"996450026049204226";https://twitter.com/jjp_network/status/996450026049204226
;2018-05-15 23:28;0;0;"Karnataka election results: 8 short, can BJP still get the numbers? https://iasgurukulpro.wordpress.com/2018/05/15/karnataka-election-results-8-short-can-bjp-still-get-the-numbers/ …";;;;"996449691331170306";https://twitter.com/IAS_Gurukul/status/996449691331170306
;2018-05-15 23:27;0;0;"@ PrannoyRoyNDTV Hi Prannoy Roy... can i talk to NDTV live now on the Karnataka Election results.. i woukd like to tell something here..";;@;;"996449517254815744";https://twitter.com/rajhcl/status/996449517254815744
;2018-05-15 23:27;0;0;"Congratulations sir for Karnataka result victory......and Best of luck for West Bengal";;;;"996449495746400256";https://twitter.com/raajput_tarun/status/996449495746400256
;2018-05-15 23:26;0;0;"Some people questioning the alliance of INC and JDS in Karnataka, but where were these people at the time of Goa result.. ಭಕ್ತರಿಗೆ ಪ್ರಿ ಬರ್ನಲ್ ಭಾಗ್ಯ ಕರುಣಿಸಿದ HDK and Siddu.. @ siddaramaiah @ HDKsupporters @ mepratap @ astitvam @ tejasvi_surya @ divyaspandana ಜೈ ಕರ್ನಾಟಕ";;@ @ @ @ @ @;;"996449318033809408";https://twitter.com/KrishnaUdagatt1/status/996449318033809408
;2018-05-15 23:25;0;0;"Karnataka election results: 8 short, can BJP still get the numbers? https://ift.tt/2rP4nmv";;;;"996448937304379392";https://twitter.com/Social_Media_ez/status/996448937304379392
;2018-05-15 23:25;0;0;"Karnataka results: End of an era and AHINDA politics https://ift.tt/2Iiwa8W";;;;"996448926994718721";https://twitter.com/Social_Media_ez/status/996448926994718721
;2018-05-15 23:25;0;0;"Five takeaways from Karnataka election results https://ift.tt/2rI93Kv";;;;"996448920371912704";https://twitter.com/Social_Media_ez/status/996448920371912704
;2018-05-15 23:25;0;0;"Karnataka election results: Congress makes a dare for power, BJP struggles to reach majority mark https://ift.tt/2rJ9iFt";;;;"996448916966182913";https://twitter.com/Social_Media_ez/status/996448916966182913
;2018-05-15 23:25;0;0;"Karnataka elections: Bengaluru results quite the same, with some surprises https://ift.tt/2k2M5Kd";;;;"996448913547845632";https://twitter.com/Social_Media_ez/status/996448913547845632
;2018-05-15 23:25;0;0;"Modi on Karnataka election results: Congress tried to paint BJP as party of Hindi-speaking states https://ift.tt/2wIrLGR";;;;"996448911769337858";https://twitter.com/Social_Media_ez/status/996448911769337858
;2018-05-15 23:25;0;0;"result Karnataka ka aa ya he or ye miss modi bhakt ise desh ka mood bata rahi he";;;;"996448907356852229";https://twitter.com/3444Waseem/status/996448907356852229
;2018-05-15 23:24;0;0;"Dear @ RahulGandhi, your bootlicking propaganda may help you form government in Karnataka but you can't deny the fact that the public is with @ BJP4India . This result clearly indicates, Modi wave will be sweeping 2019 General elections. # KarnatakaVerdict # KarnatakaElections2018";;@ @;# #;"996448810632007680";https://twitter.com/theshubhamkarn/status/996448810632007680
;2018-05-15 23:24;1;2;"Not just for cricket and football matches, some people in Bengaluru are taking full day leave on Tuesday just to watch Karnataka Assembly election results. # workfromhomehttps://cmun.it/o3qt5tbd";;;#;"996448739429634048";https://twitter.com/solopreneurism/status/996448739429634048
;2018-05-15 23:24;0;0;"Karnataka election results: It's now over to governor's 'subjective judgment' https://campaigns.localzoho.com/ua/SharedView?od=11c31c02b7dfc&pno=117b219943e4fc7&pd=11c676900e6a41c …";;;;"996448628574117888";https://twitter.com/sameherealso/status/996448628574117888
;2018-05-15 23:23;0;0;"Karnataka Election Results 2018 highlights: Siddaramaiah meets Kumaraswamy, says Cong-JD(S) will form government http://criptocurrencycertification.com/karnataka-election-results-2018-highlights-siddaramaiah-meets-kumaraswamy-says-cong-jds-will-form-government/ …";;;;"996448537805230080";https://twitter.com/Criptocurrencyc/status/996448537805230080
;2018-05-15 23:23;0;0;"Karnataka election results: Rivals stake claim to form government as BJP falls short of majority via @ htTweetshttps://m.hindustantimes.com/india-news/karnataka-election-2018-results-down-to-the-wire-for-bjp-congress-in-early-trends/story-xo4JZ37Apko7jMw6QBzKML.html …";;@;;"996448518783971329";https://twitter.com/rajunaidu19/status/996448518783971329
;2018-05-15 23:23;0;0;"@ prakashraaj after Karnataka results @ BJP4India @ narendramodi @ AmitShahpic.twitter.com/FCxp4yXQ2O";;@ @ @ @;;"996448486492008448";https://twitter.com/varun_sant/status/996448486492008448
;2018-05-15 23:23;1;2;"Karnataka Election Results : Hubli-Dharwad EVM Machine Fault, Result Holded | ಸುದ್ದಿ ಟಿವಿ Suddi TV @ dilipkpandey # KarnatakaElectionResults # HubliDharwad # EVMMachineFault # Result # Holded # News # Politics # KarnatakaElectionNews http://www.sudditv.com https://www.facebook.com/sudditv/videos/929458503929070/ …";;@;# # # # # # # #;"996448427843043330";https://twitter.com/KhannaPal/status/996448427843043330
;2018-05-15 23:22;0;0;"@ Swamy39 Sir the means are not important. The result shud be a BJP govt in Karnataka. https://twitter.com/Swamy39/status/996355637519859712 …";;@;;"996448348671393792";https://twitter.com/kamathpooja1/status/996448348671393792
;2018-05-15 23:21;0;0;"# KarnatakaVerdict # Karnatakaelections # karnatakaelectionresults2018 # karnatakaelectionmemes # comedymemes Karnataka election results 2018 comedy memes https://youtu.be/5dvcacoVPFU via @ YouTube";;@;# # # # #;"996448073529245696";https://twitter.com/Naachystv/status/996448073529245696
;2018-05-15 23:21;0;0;"Ashamed to see the results of Karnataka Elections. This means the votes we put to form a government has lost its value now and the jds and congress got merged to form the government! # ashamed # KarnatakaVerdict # KarnatakaElections2018 @ narendramodi @ BJP4India";;@ @;# # #;"996447992910561280";https://twitter.com/addy0307/status/996447992910561280
;2018-05-15 23:21;2;8;"Karnataka results: End of an era and AHINDA politics https://www.livemint.com/Opinion/vYVeFaPvcsRYT47zjiamMM/Karnataka-results-End-of-an-era-and-AHINDA-politics.html …";;;;"996447934840557568";https://twitter.com/livemint/status/996447934840557568
;2018-05-15 23:20;0;0;"I have been trying to shop for a few MLAs of Karnataka for my Mota bhai with an option of gift-wrap, but my Amazon search doesn't render any result.";;;;"996447653318746112";https://twitter.com/Anup_Gooner/status/996447653318746112
;2018-05-15 23:20;3;34;"Karnataka election results 2018: Three key takeaways for the BJP http://read.ht/Bmta pic.twitter.com/RKPSjCxilZ";;;;"996447620284346368";https://twitter.com/htTweets/status/996447620284346368
;2018-05-15 23:19;1;0;"@ AmitShah heartiest congratulations on victory of @ BJP4India in Karnataka elections. It's result of sacrifice & hardwork of party workers & leaders,your dynamic leadership, people oriented policies & work of our Central Government led by our beloved Prime Minister @ narendramodi";;@ @ @;;"996447507356921857";https://twitter.com/RajeevS27545206/status/996447507356921857
;2018-05-15 23:19;0;0;"I liked a @ YouTube video http://youtu.be/e9EBxSc7RFo?a Who Will Rule Karnataka - Special Report on Karnataka Election 2018 Results";;@;;"996447422913175559";https://twitter.com/MohaMmedMQ3q/status/996447422913175559
;2018-05-15 23:18;0;0;"What is the result of today's Karnataka State if BJP supports JDS instead of Congress, would the governor keep silence in this manner?";;;;"996447175310589953";https://twitter.com/mukeshgambani/status/996447175310589953
;2018-05-15 23:18;0;0;"Karnataka election results LIVE: Siddaramaiah resigns as CM; Congress, JDS choose H.D. Kumaraswamy to replace him https://www.headlinesoftoday.com/india-news/politics/karnataka-election-results-live-siddaramaiah-resigns-as-cm.html …pic.twitter.com/Yl0GYPIqBu";;;;"996447161217945600";https://twitter.com/HeadlinesOT/status/996447161217945600
;2018-05-15 23:17;0;0;"I liked a @ YouTube video http://youtu.be/RjDZ0qxKouE?a Amit Shah Latest Speech After Victory In Karnataka Election Results 2018";;@;;"996447053034283008";https://twitter.com/Prajeshnair007/status/996447053034283008
;2018-05-15 23:17;0;0;"Karnataka k result se Congress ko kuch seekh Lena chahiye@Congress";;@Congress;;"996447041621504000";https://twitter.com/SaboorPathaan/status/996447041621504000
;2018-05-15 23:17;0;0;"Karnataka election result: Four possible scenarios for government formation - Times of India https://timesofindia.indiatimes.com/india/karnataka-election-result-throws-up-four-possible-scenarios/articleshow/64174568.cms … this Shud be fun- it's sure JD will b in d tough n dangerous position-knowing wat has happened to all regional parties who support # BJP";;;#;"996447031878074368";https://twitter.com/hardtoget14/status/996447031878074368
;2018-05-15 23:17;0;0;"Karnataka election results 2018: मुख्यमंत्री पद की शपथ लेंगे येदुरप्पा, 7 दिन में साबित करना होगा बहुमत https://www.jansatta.com/elections/karnataka-election-results-2018-watch-live-tv-coverage-of-karnataka-assembly-elections-results-2018-counting-online/657890/ … vía @ jansatta";;@;;"996446918774542337";https://twitter.com/ailynauto/status/996446918774542337
;2018-05-15 23:17;0;0;"# MalayalamNews Karnataka Election Results 2018: Congress-JDS Alliance Live Updates : ഇനി ഗവര്‍ണറാണ് താരം";;;#;"996446912877400064";https://twitter.com/wethestate/status/996446912877400064
;2018-05-15 23:17;0;0;"Karnataka poll result, rising oil prices plunge rupee to below 68-mark http://ilatimes.com/article.php?id=98804 …";;;;"996446887258406912";https://twitter.com/IndiaLifeTimes/status/996446887258406912
;2018-05-15 23:16;0;0;"So Mr/Ms @ republic when this is bitter reality what wud b @BJP4Undia's fate in TN, AP, Telangana, Kerala & Puducherry? Karnataka results not onlyfr PMji @ narendramodi but clear wake up call 2 realise beating Mr @ RahulGandhi easy but not winning South. Time fr Bas Jumla Please.https://twitter.com/ThandelaSays/status/996443388588187648 …";;@ @BJP4Undia @ @;;"996446767318122496";https://twitter.com/ThandelaSays/status/996446767318122496
;2018-05-15 23:16;0;0;"With Karnataka results, AP sitting MLAs party tickets in 2019 elections are in Jeopardy. # janasena # Tdp # YSRCP";;;# # #;"996446761391714310";https://twitter.com/surez0903/status/996446761391714310
;2018-05-15 23:16;0;0;"Karnataka poll results 2018: Here's the constituency wise map http://www.newindianexpress.com/elections/karnataka-polls-2018/2018/may/15/karnataka-poll-results-2018-heres-the-constituency-wise-map-1814943.html …";;;;"996446746434854912";https://twitter.com/arvindkb/status/996446746434854912
;2018-05-15 23:16;0;0;"Five takeaways from Karnataka election results - http://nternet.in/five-takeaways-from-karnataka-election-results/amp …pic.twitter.com/RWGxo8oZGc";;;;"996446647772213249";https://twitter.com/nternet_in/status/996446647772213249
;2018-05-15 23:16;0;0;"16th may .... Hotel and resort stocks open higher on account b of Karnataka results. Resorts are full of optimists and MLAs....";;;;"996446613752053760";https://twitter.com/itzrkk/status/996446613752053760
;2018-05-15 23:15;0;0;"Retweeted The Wire ( @ thewire_in): Vinod Dua discusses the Karnataka state assembly elections results and former PM Manmohan Singh's letter to the president over PM Modi's 'menacing language'. https://thewire.in/video/jan-gan-man-ki-baat-ep-242-karnataka-results-complaint-modi-language …";;@;;"996446573835022336";https://twitter.com/MHANMK/status/996446573835022336
;2018-05-15 23:15;0;0;"Now I am not so excited by victory of BJP in Karnatka because it has become like routine in election result that BJP won! Anyway hip hip hurrah for victory.";;;;"996446426358935552";https://twitter.com/gctripathi/status/996446426358935552
;2018-05-15 23:14;0;4;"@ prakashraaj After Karnataka Elections results pic.twitter.com/31AWnz1ykk";;@;;"996446297254055936";https://twitter.com/hariprasadjhaw1/status/996446297254055936
;2018-05-15 23:13;0;0;"This is the result of the tremendous work done by you for the country as well as for the BJP party. Proud of you...I am sure you & BJP will manage and sgow the majority and form a government in Karnatka.. https://twitter.com/AmitShah/status/996375594584588288 …";;;;"996445926381076481";https://twitter.com/9amitJain/status/996445926381076481
;2018-05-15 23:12;0;0;"Karnataka Election Results 2018: Congress-JD(S) enter alliance to keep BJP out of power The Congress party Tuesday announced it would back the JD(S) to form an alliance in its bid to retain power in... https://www.facebook.com/DeccanDigestOfficial/posts/2056145007934453 …";;;;"996445724823998464";https://twitter.com/DeccanDigest/status/996445724823998464
;2018-05-15 23:11;0;0;"New Haircut after Karnataka Election results @Hyderabad https://www.instagram.com/p/BizooCdnm91/?utm_source=ig_twitter_share …";;@Hyderabad;;"996445482305114113";https://twitter.com/HydDeccans/status/996445482305114113
;2018-05-15 23:11;1;0;"Now suddenly, market would realise that our macros are in pretty bad shape and would reverse post today’s Karnataka results. # KarnatakaElection2018 @ CNBCTV18News";;@;#;"996445473174048768";https://twitter.com/iVarUnjai/status/996445473174048768
;2018-05-15 23:11;0;0;"I liked a @ YouTube video http://youtu.be/ozFjEfB6Bpw?a Jan Gan Man Ki Baat, Ep 242: Karnataka Results and Complaint Over Modi's 'Menacing";;@;;"996445374003937280";https://twitter.com/suman_bahuguna/status/996445374003937280
;2018-05-15 23:10;0;0;"# KarnatakaElectionResults2018 # May15WithArnab After karnataka election results Congress offer CM seat to JD(S), who won only 38 seats. One question arises Is it not a kind of bribe ?";;;# #;"996445318794436608";https://twitter.com/akhilchy/status/996445318794436608
;2018-05-15 23:10;0;1;"Karnataka Election Results | MLA Balala Beats Rapist | Traffic Police Pledge | Teenmaar News http://v6news.tv/karnataka-election-results-mla-balala-beats-rapist-traffic-police-pledge-teenmaar-news …";;;;"996445193695105024";https://twitter.com/V6News/status/996445193695105024
