username;date;retweets;favorites;text;geo;mentions;hashtags;id;permalink
;2018-05-15 23:09;0;1;"Now this is what jaitly ji said during goa election results...the same should apply for karnataka too and congress-JD(S) govt should form the govt. The rule must be same for all. # KarnatakaVerdicthttps://twitter.com/saikatd/status/996377806371078144 …";;;#;"996445099247616000";https://twitter.com/chaitu_vempati/status/996445099247616000
;2018-05-15 23:09;0;0;"Bhai kitna ruke ab. Ab toh karnatka election ka result bhi aa gya. Trailer kab aaye @ BeingSalmanKhan bhai";;@;;"996445043320745984";https://twitter.com/ineeraj_chauhan/status/996445043320745984
;2018-05-15 23:09;0;5;"Karnataka results: End of an era and AHINDA politics https://mintne.ws/2IiwmVI";;;;"996444901138206722";https://twitter.com/livemint/status/996444901138206722
;2018-05-15 23:09;1;2;"But as today nifty action and Bjp results in karnataka pic.twitter.com/EARvXvIMmp";;;;"996444879193427968";https://twitter.com/jayramswami99/status/996444879193427968
;2018-05-15 23:08;0;0;"Who Will Rule Karnataka - Special Report on Karnataka Election 2018 Results: http://youtu.be/e9EBxSc7RFo?a via @ YouTube";;@;;"996444823866544129";https://twitter.com/fikrokhabar/status/996444823866544129
;2018-05-15 23:08;0;1;"Prannoy Roy's analysis of Karnataka election results https://www.ndtv.com/video/news/ndtv-special-ndtv-24x7/prannoy-roy-s-analysis-of-karnataka-election-results-485039 …";;;;"996444701384368128";https://twitter.com/ndtvvideos/status/996444701384368128
;2018-05-15 23:08;0;0;"Retweeted Naren Raj Purohit ( @ Narenpurohit): Devastated with today's result. @ siddaramaiah gave the best Government in last 20 years of Karnataka. Upliftment of marginalized, social justice, equality,... https://www.facebook.com/pankaj.choudhary.165/posts/874202019370943 …";;@ @;;"996444690034589697";https://twitter.com/PANCHOBH/status/996444690034589697
;2018-05-15 23:08;0;1;"Congress, BJP and JDS after election result in Karnataka! # KarnatakaElections2018 # KarnatakaElectionResults2018 # KarnatakaResultspic.twitter.com/Qy3cw1EZrv";;;# # #;"996444667028717568";https://twitter.com/shahil1123/status/996444667028717568
;2018-05-15 23:07;0;1;"* BJP after seeing Karnataka elections 2018 results * @ narendramodi @ BJPLive # KarnatakaElections2018 # KarnatakaTrustsModi # desitweetspic.twitter.com/hGk1IRvF74";;@ @;# # #;"996444565140733953";https://twitter.com/DESInghtweets/status/996444565140733953
;2018-05-15 23:07;0;1;"@ Stronginside81 saw Karnataka election results. Who will form govt. Now # KarnatakaVerdict";;@;#;"996444431019642880";https://twitter.com/rahulshah02/status/996444431019642880
;2018-05-15 23:07;0;0;"Karnataka poll result, rising oil prices plunge rupee to below 68-mark http://ilatimes.com/article.php?id=98804 …";;;;"996444384622067712";https://twitter.com/suniltristar/status/996444384622067712
;2018-05-15 23:06;0;0;"@ ceo_karnataka What about Hubli Dharwada Centre Result?";;@;;"996444292691382272";https://twitter.com/JadeerTK/status/996444292691382272
;2018-05-15 23:06;0;0;"I liked a @ YouTube video http://youtu.be/ozFjEfB6Bpw?a Jan Gan Man Ki Baat, Ep 242: Karnataka Results and Complaint Over Modi's 'Menacing";;@;;"996444142354993152";https://twitter.com/yammarmanvi/status/996444142354993152
;2018-05-15 23:05;0;0;"Karnataka election results ????";;;;"996443942819434496";https://twitter.com/PrinceParwej/status/996443942819434496
;2018-05-15 23:04;0;0;"Karnataka Election Results 2018: How state voted shows why Bengaluru model needs to be emulated more http://indianexpress.com/article/opinion/karnataka-election-results-2018-the-bengaluru-model-needs-to-be-emulated-across-karnataka-5178158/ …";;;;"996443799659270144";https://twitter.com/nandu79/status/996443799659270144